{
  "$schema": "https://anthropic.com/claude-code/marketplace.schema.json",
  "name": "claude-plugin-marketplace",
  "version": "1.0.0",
  "description": "Plugin marketplace for Claude Code",
  "owner": {
    "name": "edward-seo"
  },
  "plugins": [
    {
      "name": "grd",
      "description": "Get Research Done — R&D workflow automation for Claude Code",
      "version": "0.6.0",
      "author": {
        "name": "Cameleon X"
      },
      "source": {
        "source": "url",
        "url": "git@github.com:ca1773130n/GetResearchDone.git"
      },
      "category": "development",
      "homepage": "https://github.com/ca1773130n/GetResearchDone"
    },
    {
      "name": "harness-sync",
      "description": "Sync Claude Code configuration to Codex, Gemini CLI, and OpenCode. Configure once, sync everywhere.",
      "version": "0.2.1",
      "author": {
        "name": "HarnessSync Contributors"
      },
      "source": {
        "source": "url",
        "url": "git@github.com:ca1773130n/HarnessSync.git"
      },
      "category": "development",
      "homepage": "https://github.com/ca1773130n/HarnessSync"
    },
    {
      "name": "tesserae",
      "description": "Slash commands, hooks, a skill, and MCP auto-registration for the Tesserae project-memory compiler. Drive the full tesserae workflow from inside a Claude Code session.",
      "version": "0.38.0",
      "author": {
        "name": "Tesserae Contributors"
      },
      "source": {
        "source": "url",
        "url": "git@github.com:ca1773130n/Tesserae.git"
      },
      "category": "development",
      "homepage": "https://github.com/ca1773130n/Tesserae"
    }
  ]
}
